Title,Author,Main Character,Plot Summary,Document
Pride and Prejudice,Jane Austen,Elizabeth Bennet and Mr. Darcy,Elizabeth Bennet and Mr. Darcy navigate societal pressures and find love.,"In 'Pride and Prejudice' by Jane Austen, Elizabeth Bennet and Mr. Darcy navigate societal pressures and find love."
Harry Potter and the Sorcerer's Stone,J.K. Rowling,Harry Potter,Introduces us to a young wizard discovering his identity.,J.K. Rowling's 'Harry Potter and the Sorcerer's Stone' introduces us to a young wizard discovering his identity.
To Kill a Mockingbird,Harper Lee,Scout Finch,Scout Finch witnesses racial injustice in her hometown.,"In 'To Kill a Mockingbird' by Harper Lee, Scout Finch witnesses racial injustice in her hometown."
The Hobbit,J.R.R. Tolkien,Bilbo Baggins,Bilbo Baggins embarks on an unexpected adventure,Bilbo Baggins embarks on an unexpected adventure in J.R.R. Tolkien's 'The Hobbit'.
Brave New World,Aldous Huxley,Not specified,The novel depicts a future society driven by technological advancements.,'Brave New World' by Aldous Huxley depicts a future society driven by technological advancements.
