Name,Company,Start Year,End Year,Position,Document
Emma Smith,FinBank,2012,2014.0,Analyst,Emma Smith worked at FinBank as an Analyst from 2012-2014.
Robert Brown,ArtHouse,2019,,Senior Designer,Robert Brown has been a Senior Designer at ArtHouse since 2019.
Olivia Johnson,BioLab,2015,2017.0,Research Fellow,Olivia Johnson was a Research Fellow at BioLab between 2015 and 2017.
Michael Williams,HealthCare Inc.,2009,2013.0,Nurse,Michael Williams was employed by HealthCare Inc. as a Nurse from 2009 to 2013.
Sophia Taylor,AutoCorp,2016,2020.0,Sales Manager,Sophia Taylor has experience as a Sales Manager at AutoCorp from 2016-2020.
